Comment,https://Link"Кадиллак Экскалейд расходует 14л бензина на 100 км.
Это значит, 5,96 американских галлонов на 100 американских миль.
То есть, на одну милю надо 0,0596 галлона бензина.",https://pikabu.ru/story/svidanie_po_byistromu_9117001
"Ващето... они там считают, сколько миль машина проедет на галлоне. А не как у нас сколько литров на 100 км.",https://pikabu.ru/story/svidanie_po_byistromu_9117001
5 пикабушников при температуре 11° все понятно,https://pikabu.ru/story/svidanie_po_byistromu_9117001
"Я без звука смотрел, два раза, потому что шакалистые сабы =))",https://pikabu.ru/story/svidanie_po_byistromu_9117001
"Перевёл субтитры вместо того, чтобы включить звук?
Крут :)",https://pikabu.ru/story/svidanie_po_byistromu_9117001
Ага :(,https://pikabu.ru/story/svidanie_po_byistromu_9117001
"А я хочу сказать спасибо, за проделанный труд ""так как  возможности посмотреть со звуком нет""",https://pikabu.ru/story/svidanie_po_byistromu_9117001
Эпик фейл)) Но за старание плюсик всё равно поставил)),https://pikabu.ru/story/svidanie_po_byistromu_9117001
Эпик фейл это когда гвоздиком в ухе ковырялся и звук пропал. А это так...,https://pikabu.ru/story/svidanie_po_byistromu_9117001
Лига антилени вышла на новый уровень?,https://pikabu.ru/story/svidanie_po_byistromu_9117001
Когда проще перевести субтитры чем включить звук),https://pikabu.ru/story/svidanie_po_byistromu_9117001
"Ого, они ещё и на русском говорят. Теперь я понял претензию ко мне про футы вместо метр восемьдесят.",https://pikabu.ru/story/svidanie_po_byistromu_9117001
ЛЛГС,https://pikabu.ru/story/svidanie_po_byistromu_9117001
"Она сказала: ""Не люблю низких пацанов"". Это обиднее))",https://pikabu.ru/story/svidanie_po_byistromu_9117001
"А он ответил - ""Нихуя себе низкий, блядь..""
Какой-то кастрированный ""перевод"", в общем. Смысл остался, а эмоции потеряны, официальный дубляж по ходу.",https://pikabu.ru/story/svidanie_po_byistromu_9117001
"Да по ней видно, что останется без парня ещё надолго.",https://pikabu.ru/story/svidanie_po_byistromu_9117001
"главное чтоб свою голую тушку не постила в инетике ""вот какая красотка, никто не ценит, блеадь!""",https://pikabu.ru/story/svidanie_po_byistromu_9117001
"Она сказала ""нызких"", а он ответил также. Это откуда такой акцент?",https://pikabu.ru/story/svidanie_po_byistromu_9117001
"На Украине любят такой треш снимать, беременна в 16 из той же выгребной ямы",https://pikabu.ru/story/svidanie_po_byistromu_9117001
"Спасибо. А то нихрена понять не мог, говорят, будто хуи изо рта не вынули.",https://pikabu.ru/story/svidanie_po_byistromu_9117001
Спасибо,https://pikabu.ru/story/svidanie_po_byistromu_9117001
"Надо выше 9/11
Раз читаешь титры, для той части мира",https://pikabu.ru/story/svidanie_po_byistromu_9117001
9/11 это что-то на уровне фундамента,https://pikabu.ru/story/svidanie_po_byistromu_9117001
Продолжение будет?,https://pikabu.ru/story/svidanie_po_byistromu_9117001
Плюсов этому джентльмену!,https://pikabu.ru/story/svidanie_po_byistromu_9117001
"там ещё было 'мужская солидарность', но в видос не вошло",https://pikabu.ru/story/svidanie_po_byistromu_9117001
нормально. хамство порождает ответное хамство.,https://pikabu.ru/story/svidanie_po_byistromu_9117001
И искреннее удивление инициатора при получении ответочки,https://pikabu.ru/story/svidanie_po_byistromu_9117001
"мне это тоже понравилось....""типа как это!? девочек низя обижать"" :)",https://pikabu.ru/story/svidanie_po_byistromu_9117001
"А я сижу смотрю без звука, пытаюсь перевести, а эта херня оказывается на русском!!",https://pikabu.ru/story/svidanie_po_byistromu_9117001
"Ага, этот новый плеер автозапускается без звука!",https://pikabu.ru/story/svidanie_po_byistromu_9117001
Шоу уродцев.,https://pikabu.ru/story/svidanie_po_byistromu_9117001
"Ой да просто малолетки на камеру кривляются, чо так сразу категорично. Шоу есть шоу. А народ всегда любил посмотреть на уродцев, так что приходится соответствовать=)",https://pikabu.ru/story/svidanie_po_byistromu_9117001
Знакомство - как красиво нахамить и остаться одному. Что бы перестать размножаться им даже презервативы не понадобятся.,https://pikabu.ru/story/svidanie_po_byistromu_9117001
Сам себе контрацептив.,https://pikabu.ru/story/svidanie_po_byistromu_9117001
"Это же здорово, когда проблема сама себя решает. Хамло вымрет со временем)))",https://pikabu.ru/story/svidanie_po_byistromu_9117001
"похоже она получила, что хотела",https://pikabu.ru/story/svidanie_po_byistromu_9117001
"Вот потому я и не реагирую на баб, смотрящих на меня.
- Чё смотришь? Я тож смотреть могу. Я в эту игру могу долго играть, но хуй тебе слово скажу, так как опасаюсь, что ты ебанутая и тут же отошьёшь меня. Оу, извини, ты услышала!? Я не заметил.
- Чувак, ты всё это сказал вслух. Стоя в метре передо мной...",https://pikabu.ru/story/svidanie_po_byistromu_9117001
"У всех есть свои вкусы, но вот озвучивание их в подобном виде превращает процесс в рыночные отношения.",https://pikabu.ru/story/svidanie_po_byistromu_9117001
"Судя по кнопке на столе, суть этого шоу (?) заключается именно в озвучивании.

Я, когда ходил по свиданиям, пару раз жалел, что нет такой кнопки. Вроде сразу понятно, что не моё, а просто сказать «извини, ты стремная, на фото было по-другому» не позволяло воспитание.",https://pikabu.ru/story/svidanie_po_byistromu_9117001
"""Чо, может лучше по домам?"" разок спасло",https://pikabu.ru/story/svidanie_po_byistromu_9117001
"— А почему? Я тебе не нравлюсь?
— Да
— Скотина!!",https://pikabu.ru/story/svidanie_po_byistromu_9117001
"Ну или ""шлюха"" если отшивает девушка. Культра-с",https://pikabu.ru/story/svidanie_po_byistromu_9117001
"Культра-с
Это какая то радикальная группировка? )
Ультрас - это футбольные фанаты, а культрас - фанаты культурологии?",https://pikabu.ru/story/svidanie_po_byistromu_9117001
Агрессивные фанаты),https://pikabu.ru/story/svidanie_po_byistromu_9117001
Агрессивные культуристы )),https://pikabu.ru/story/svidanie_po_byistromu_9117001
Кто нас призвал!?,https://pikabu.ru/story/svidanie_po_byistromu_9117001
Я!,https://pikabu.ru/story/svidanie_po_byistromu_9117001
Золотые мальчики,https://pikabu.ru/story/svidanie_po_byistromu_9117001
Золотые пальчики,https://pikabu.ru/story/svidanie_po_byistromu_9117001
Геологи наверное,https://pikabu.ru/story/svidanie_po_byistromu_9117001
Петербуржцы,https://pikabu.ru/story/svidanie_po_byistromu_9117001
Потому что удобно разрубать по рельефу?,https://pikabu.ru/story/svidanie_po_byistromu_9117001
Один раз не культура-с,https://pikabu.ru/story/svidanie_po_byistromu_9117001
Фанаты куни,https://pikabu.ru/story/svidanie_po_byistromu_9117001
КультУрологии - уже страшно. А если там еще агрессивные..,https://pikabu.ru/story/svidanie_po_byistromu_9117001
"Они словесно тебя задавят французским
физически- штыками)",https://pikabu.ru/story/svidanie_po_byistromu_9117001
"Это солдаты Семеновского полка времен Петра I
1. Французский тогда был не в моде
2. Простые солдаты (вчерашние крестьяне) вообще иностранных языков не знали
3. Офицеры (дворяне) тогда изучали не французский, а немецкий",https://pikabu.ru/story/svidanie_po_byistromu_9117001
"Не попал по времени получается)
по всем вашим пунктам- вы правы.
Спасибо за уточнение)",https://pikabu.ru/story/svidanie_po_byistromu_9117001
Новый кандидат на главу лиги зануд),https://pikabu.ru/story/svidanie_po_byistromu_9117001
всегда думаю что такая девушка испугалась моего огромного члена и становится спокойнее,https://pikabu.ru/story/svidanie_po_byistromu_9117001
"Причем она посчитала, что это ты ее слил, по этой же причине",https://pikabu.ru/story/svidanie_po_byistromu_9117001
"Ежели такой человек попадается, значит либо мудак, коего сразу далеко и надолго, либо ""фи ты мерзкий и нищий, покеда"" (утрировано, естественно). Хотя донести человеку, что он не интересует стоит, чтобы не строил ложных надежд",https://pikabu.ru/story/svidanie_po_byistromu_9117001
"Ну, не устроил же. Сказать надо, но после нескольких раз у человека иногда возникает эгоистичное желание не выслушивать говно в свой адрес и потому сливаться молча. Или находить ""не мудака"" нужно гадая по фото, а если по глазам не узнала сама дура? Тип мы о свиданиях и знакомствах говорим.",https://pikabu.ru/story/svidanie_po_byistromu_9117001
"Возможно дело в деликатоности. А насчёт адекватности человека, то тут стоит пообщаться какое-то время в сети. Знаю много примеров, когда девушки летят сходу на свидание (да что уж там, парни тоже) не имея ни малейшего представления о том, что за человек придёт к ним",https://pikabu.ru/story/svidanie_po_byistromu_9117001
"Я один раз пришёл на свидание в один ресторан, сижу жду и тут садится она. Раза в два тяжелее выглядет, чем на фото, ну и моё внимание привлёк вырез на груди на свитере. Там я увидел толстые, длинные чёрные волосы, в длину были сантиметра по 4 точно и да росли они не так плотно, как на голове, но всё же. От такого я даже закашлялся, так как мозг начал рисовать картинку как выглядит её грудь и мне стало омерзительно видеть её. Я просто встал, поднёс к уху телефон и сказал что у меня уважительная причина и почти бегом выбежал из заведения.

Я до сих пор не могу поверить в то что я видел, но не могла молодая девушка выйти в таком виде на улицу, я даже задумываюсь, что возможно меня переключило и я увидел, то чего нет.",https://pikabu.ru/story/svidanie_po_byistromu_9117001
"Девушка опаздывала на первую встречу, говорила - выбирает новые босоножки. Ну ок, жду. Дождался. Ногти на её ногах так распидарасило грибком, что я аж глазам не поверил, думал - педикюр какой-то экстравагантный. Но нет, это прям Грибы. А она такая - куда смотришь, никуда, говорю. Прошли кружочек, и я так с надеждой - ну ты наверно на каблуках уже устала, а она - нет, не устала... Просто дичь, зная о таких проблемах целенаправленно их демонстрировать - это всё равно, что ходить с геморроем наружу.",https://pikabu.ru/story/svidanie_po_byistromu_9117001
"Одна дама не давала раком, геморроя стеснялась.",https://pikabu.ru/story/svidanie_po_byistromu_9117001
Ну и дура. Можно ведь щелбаны по шишечкам щелкать пока ебешь. Разнообразить процесс так сказать.,https://pikabu.ru/story/svidanie_po_byistromu_9117001
"У меня было нечто подобное. Познакомился с девушкой: красивая, стройная, длинные волосы. В общем, привел домой, заняли горизонтальное положение, я сверху целую ее грудь и тут мне попадается на губах длинный волос, я его пытаюсь убрать, а он не убирается. Я понимаю, что тянется он не с стороны головы, а четко с груди.... Минута паузы, она снизу смотрит на меня, я сверху на нее. Я секунду подумал и решил, что не такой уж я и брезгливый, когда секс перепадает не каждый день.",https://pikabu.ru/story/svidanie_po_byistromu_9117001
неожиданная концовка,https://pikabu.ru/story/svidanie_po_byistromu_9117001
"Всё может быть)
Однажды мне делали операцию при которой должны были быть выбриты подмышки. В общем, медсестра меня везет на каталке в операционную, нас догоняет хирург и спрашивает ""Пациентка побрита?"" Я удивилась вопросу и поинтересовалась, где он видел 30-летнюю женщину в 30-градусную жару с небритыми подмышками. Он печально вздохнул и сказал, что видел и не такое)))",https://pikabu.ru/story/svidanie_po_byistromu_9117001
"У меня была девушка-армянка. Все при ней. Формы офигенные, рост как надо, упругая, мордаха симпатичная. Короче, баба-огонь. А какой темперамент! Ты ее по руке погладил, а у нее аж зрачки раширялись и сосцы начинали выпячиваться! Но вот единственный минус, который я не смог принять это волосы! На руках, на пояснице, на шее. Настоящий мех! Ноги она брила, а остальное ее не волновало. Я так и не смог ей ничего сказать по этому поводу, пришлось сливаться. Я так и не смог себя пересилить. Сейчас, конечно, понимаю, что вопрос решался бабками и лазерной эпиляцией.",https://pikabu.ru/story/svidanie_po_byistromu_9117001
А бабка зачем?,https://pikabu.ru/story/svidanie_po_byistromu_9117001
"Делать шугаринг, потому что у бабок есть сахар.",https://pikabu.ru/story/svidanie_po_byistromu_9117001
"Представил, как бабка, шамкая, говорит как 'сахарные мои' - 'шугарные мои'. Хз, зачем я поделился этой хуйней.",https://pikabu.ru/story/svidanie_po_byistromu_9117001
Причитать?,https://pikabu.ru/story/svidanie_po_byistromu_9117001
"Я как-то познакомился на одном интернет форуме с одной девушкой, переписывались какое-то время, а потом решили встретиться, до встречи даже фоток ее не видел. И вот мы встретились, сходили в кино, потом в парке погуляли и разьехались по домам. И самое главное, что вот по внутреннему миру казалось нашел свою половинку. По интересам, по взглядам,по темпераменту вот всё мое, а внешне увы не моё. Эх. Свиданий были кучи, а это вот до сих пор в голове держу и думаю ну как так...",https://pikabu.ru/story/svidanie_po_byistromu_9117001
"Да... внешка очень многое решает, ну и секс тоже.  Короче, сложно это, чтобы всё совпало.",https://pikabu.ru/story/svidanie_po_byistromu_9117001
"Ух ёпт, а я бы наоборот - остался бы чтобы исследовать подобный экспонат и взять интервью. Когда ещё в жизни такая возможность выпадет :D",https://pikabu.ru/story/svidanie_po_byistromu_9117001
"Тоже подобный опыт был: присылала фотки, наверное, двухлетней давности, да и те на уровне плеч. Видно было, что полненькая (что некоторым девушкам даже идёт), но вот то, что с момента тех фотографий она успела ещё десятка полтора-два кг набрать, из-за чего уже выглядела не как милая пухляша, а как Джаггернаут. - этот факт скрывался.",https://pikabu.ru/story/svidanie_po_byistromu_9117001
звонок от друга спасает ситуацию беспроигрышно спасает ситуацию.,https://pikabu.ru/story/svidanie_po_byistromu_9117001
"/тяжелое сопение/
- Дорогая мне пора.
- но я же еще не кончила!
- извини, мне позвонил друг...",https://pikabu.ru/story/svidanie_po_byistromu_9117001
"Да к чему эти схемы/махинации, когда все взрослые люди",https://pikabu.ru/story/svidanie_po_byistromu_9117001
"А почему нет? Взрослые же люди, все понятно",https://pikabu.ru/story/svidanie_po_byistromu_9117001
"Ну это нужно либо друга напрягать, либо музыку включать без палева. Сложно и долго",https://pikabu.ru/story/svidanie_po_byistromu_9117001
"Так заренее будильник заведи, как маленький блин, если норм просто сбрасываешь, нет ""звонок друга"".",https://pikabu.ru/story/svidanie_po_byistromu_9117001
А когда не спасало - что происходило?,https://pikabu.ru/story/svidanie_po_byistromu_9117001
Смерть от сну-сну,https://pikabu.ru/story/svidanie_po_byistromu_9117001
"Я раз пришёл на свидание а там девушка только на 80-90 кг больше чем на фото . Я спросил почему так . Она сказала , так вы не соглашаетесь прийти когда видите меня такой . Я ответил - так я сейчас тупо ухожу .",https://pikabu.ru/story/svidanie_po_byistromu_9117001
"Я вот читаю коммент и такое ощущение, что девушка только на 80-90 больше. А хотелось бы на 120-150....",https://pikabu.ru/story/svidanie_po_byistromu_9117001
YouTube●0:16,https://pikabu.ru/story/svidanie_po_byistromu_9117001
"Тоже самое, когда приходишь,  а чел на 10 лет старше чем на фотке и "" ой я случайно забыл фото обновить"". Ага , конечно,  случайно",https://pikabu.ru/story/svidanie_po_byistromu_9117001
"Я помню на Мамбе девушка за 200кг написала в анкете, что очень хочет секса. Приезжайте. Ходить не может. Инвалид-опорник.
Так там такая очередь желающих выстроилась...",https://pikabu.ru/story/svidanie_po_byistromu_9117001
Инвалид-опорник? Дима Тарасов?,https://pikabu.ru/story/svidanie_po_byistromu_9117001
"Анкета дамы была. Еще она писала, не надо цветов и тортиков, подарите лучше фалоимитатор.",https://pikabu.ru/story/svidanie_po_byistromu_9117001
С крючка хоть снял потом?,https://pikabu.ru/story/svidanie_po_byistromu_9117001
Не каждый крючок 200 кг выдержит )))),https://pikabu.ru/story/svidanie_po_byistromu_9117001
"Она сказала , так вы не соглашаетесь прийти когда видите меня такой .
Идиотки.  Потому что те, кто толстушек любит - пролистывают их анкеты. А так как таких мало - надо просто иметь терпение чтобы их найти.",https://pikabu.ru/story/svidanie_po_byistromu_9117001
"Ну, сказать ""сорян, ты не в моём вкусе"" вполне было бы прилично.",https://pikabu.ru/story/svidanie_po_byistromu_9117001
"А если она скажет, что может майонезом обмазаться. Так лучше будет?",https://pikabu.ru/story/svidanie_po_byistromu_9117001
но так ведь и правда лучше,https://pikabu.ru/story/svidanie_po_byistromu_9117001
"Говоришь ""извините девушка, вы такая милая что я не могу вам врать, я хронический алкоголик, пару дней как не пью, но я не хочу вам портить жизнь, это была ошибка мне прийти, удачи вам"".",https://pikabu.ru/story/svidanie_po_byistromu_9117001
"извините девушка, вы такая милая что я не могу вам врать, я хронический алкоголик, пару дней как не пью, но я не хочу вам портить жизнь, это была ошибка мне прийти, удачи вам
А она - ""мы созданы друг для друга! - официант, принесите литр водки!""",https://pikabu.ru/story/svidanie_po_byistromu_9117001
"А ты такой - ""ну в принципе норм баба, хз чё это я развыёбывался"".",https://pikabu.ru/story/svidanie_po_byistromu_9117001
ну так после литра водки и похуй уже на вкусы),https://pikabu.ru/story/svidanie_po_byistromu_9117001
