Comment,https://Link"Блядь, гребаное упорство!
Ехала как то на новую работу на всех возможных видах транспорта. Меня укачало сначала в электричке, а потом в автобусе окончательно и я наблевала прямо перед порогом служебного входа.
А ко всему, ещё и месячные, лились как водопад, и приехала я с пятном на заднице, и не могла никуда сесть, и не во что было переодеться. Кажется, после этого меня уволили.",https://pikabu.ru/story/uporstvo_voznagrazhdeno_9117516
Кажется?,https://pikabu.ru/story/uporstvo_voznagrazhdeno_9117516
"Решил я сменить работу, вижу вакансия, продажник, работа удаленная.

На собеседовании:  сделки с ЛПР все удаленно, через вацап или презентации. Все ок все обсудили.

Я:  ок. работаем.
HR: решение в понедельник напишем вам.


Вторник: *пикча

зы
а у меня усы и волосы в хвост )",https://pikabu.ru/story/uporstvo_voznagrazhdeno_9117516
"Хех, вспомнил свою историю. Сам я погромист, в основном сижу на фрилансе, большую часть времени пинаю хуи, хожу по барам, да горам. Но как-то наскучил подобный образ жизни, решил пойти в какую-нибудь галеру. На хз создал резюме, через пару дней позвонили, поговорили с главным разрабом, пригласили на собес. Но что-то мне не понравилось, и интуиция прям орала что не стоит ехать ( тем более один заказ горел, дедлайны ебанные). Ну а я чё, я же пообещал приехать. За полтора часа вызвал такси, думалт заранее приеду, минут 20-30 посижу в парке, мороженое поем. Хуй там плавал. Первый таксист ехал 15 минут и сломался метрах в 200 от меня. Ок, не критично, вызываю второе такси. Приезжает убитая тачка, на всем маршруте встречаем только красный сигнал светофора. Вот блядь серьезно. Только один раз успевали на зелёный, но там мудак подрезал, пока они сигналили друг другу - загорелся красный. Так чем все закончилось-то. Подъезжал я тютелька в тютельку, прям до назначенного времени осталось минут шесть, на месте был бы минуты через четыре. Так вот блядь только машина решила сломаться прям ровно посередине перекрестка. Ну я и решил что явно туда идти нахуй не надо, купил мороженое и пошел пешком домой. В принципе не жалею :)",https://pikabu.ru/story/uporstvo_voznagrazhdeno_9117516
"Если поливать конкурентов из шланга с водкой, их точно на работу не возьмут 😁",https://pikabu.ru/story/uporstvo_voznagrazhdeno_9117516
"Опять очередная небылица. В городе никто не знает про такси которое подвозит к подъезду  офисного здания у которого есть козырек . И все. вы сухой.
Никто не знает. так бывает. Кот. Лампа.",https://pikabu.ru/story/uporstvo_voznagrazhdeno_9117516
"Эту историю перепащивают ещё со времён газеты ""Эфир"" и ""Из рук в руки"". Опять люберецкие качки ремонт затеяли?",https://pikabu.ru/story/uporstvo_voznagrazhdeno_9117516
"Бывший муж пришёл устраиваться на должность веб-разработчика, а в компании прорвало трубу и начало затапливать туалет. Секретарша в шоке что-то бегает, суету наводит. Он пошёл и трубы им перекрыл. Ну они его на радостях и приняли. Ему, правда, весь этот движ очень не понравился и он отклонил оффер.",https://pikabu.ru/story/uporstvo_voznagrazhdeno_9117516
Директор по клирингу.,https://pikabu.ru/story/uporstvo_voznagrazhdeno_9117516
YouTube●2:39,https://pikabu.ru/story/uporstvo_voznagrazhdeno_9117516
Что-то очень часто стали попадаться скрины с adme. Это новый тренд такой?,https://pikabu.ru/story/uporstvo_voznagrazhdeno_9117516
Работали всей маршруткой,https://pikabu.ru/story/uporstvo_voznagrazhdeno_9117516
"Вспомнил, как я проходил одно очень интересное собеседование.
Там со мной долго общались целых два хр. Очень вежливо и профессионально. Долго гоняли по разным вопросам, связанным с работой, разбирали возможные ситуации.
И вот один из вопросов был - если вы попали под ливень/либо вас облила машина и вы промокли, пойдете ли вы на встречу или попробуете ее перенести, позвонив клиенту?
Так вот - ошибочными было два ответа (мы это обсудили):
1. Пойду на встречу не взирая ни на что. ""То есть вы своим видом создадите негативное впечатление перед клиентом и тем самым повредите престижу фирмы. Это неприемлемо""
2. Постараюсь перенести встречу, объяснив ситуацию. ""То есть вы сорвете встречу с архиважным клиентом, о которой в компании договаривались более полугода, уговаривая его? Это неприемлемо""

П.С. Мой ответ был - вернусь в машину, переоденусь и приведу себя в порядок, а так как на встречи я приезжаю заранее, я не опоздаю. На возражение хр ""у вас что, в машине запасной костюм всегда?"" я ответил ""да, моя машина припаркована прямо около вашего офиса, можем пойти и я продемонстрирую"".

П.П.С. В приеме на работу мне отказали, а через пару недель сначала переехали в другой офис похуже, затем сократили половину народа, а потом обанкротились к хренам! Ибо нефиг (но разумеется это не от меня зависело, просто так совпало и я получил некоторое моральное удовлетворение).",https://pikabu.ru/story/uporstvo_voznagrazhdeno_9117516
"Очередная котолампа, да ещё и с помойки adme.",https://pikabu.ru/story/uporstvo_voznagrazhdeno_9117516
"А я так в один из институтов не поступил, НГАВТ называется... Меня только, что на хуях не оттаскали... А я, без шуток, мокрый насквозь и с меня бежало прям... Столько нового узнал о себе...",https://pikabu.ru/story/uporstvo_voznagrazhdeno_9117516
И великий рандом всех рассудит.,https://pikabu.ru/story/uporstvo_voznagrazhdeno_9117516
"А оказалось потом, что он просто упертый долбоеб...",https://pikabu.ru/story/uporstvo_voznagrazhdeno_9117516
"По большому счету, работодатель не ценит твоих жертв. Чаще всего принимает как должное, типа черта твоего характера такая…полезно.",https://pikabu.ru/story/uporstvo_voznagrazhdeno_9117516
"взяли техничкой вместо тим лида?
ну тоже неплохо",https://pikabu.ru/story/uporstvo_voznagrazhdeno_9117516
"Что-то подобное было, когда устраивался на нынешнюю. Всё тот же ливень, да промок до нитки - только в кадрах напоили чаем и отправили к начальнику по логистике в офис (изначально шёл на склад, но предложили менее напряжную вакансию)",https://pikabu.ru/story/uporstvo_voznagrazhdeno_9117516
Этим дедом был Альберт Эйнштейн,https://pikabu.ru/story/uporstvo_voznagrazhdeno_9117516
"А потом соискателю сели на шею по полной программе. Потому что,поняли— ему эта работа пиздец как нужна,а потому он всё выдержит.",https://pikabu.ru/story/uporstvo_voznagrazhdeno_9117516
"У меня жена так устроилась на работу. Во Владивостоке, по пути на собес, попала под ливень, ветер.
Все остальные кандидаты не пришли либо отменили. Её и взяли.",https://pikabu.ru/story/uporstvo_voznagrazhdeno_9117516
"Может, стоило указать, на какую должность шел. Возможно, на уборщика",https://pikabu.ru/story/uporstvo_voznagrazhdeno_9117516
Ёжики плакали кололись но продолжали лезть в мясорубку.,https://pikabu.ru/story/uporstvo_voznagrazhdeno_9117516
Бонус:,https://pikabu.ru/story/marketologi_ot_boga_9117902
Это лучше всего,https://pikabu.ru/story/marketologi_ot_boga_9117902
"Выглядит это гораздо лучше, чем звучит))))",https://pikabu.ru/story/marketologi_ot_boga_9117902
"гспд как перестать ржать над этим?! Это же моя работа.... (не конкретно эта этикетка, но иногда такое заказывают, диву даешься)",https://pikabu.ru/story/marketologi_ot_boga_9117902
"Эх, хотела купить сейчас, а они дизайн поменяли. Теперь вот так уныло:",https://pikabu.ru/story/marketologi_ot_boga_9117902
"Стопорнулась на тельнике из тигра, но в конце от души порадовалась, громко, в голос))",https://pikabu.ru/story/marketologi_ot_boga_9117902
Классно же придумано! И по цветам и по акцентам),https://pikabu.ru/story/marketologi_ot_boga_9117902
"Странные этикетки привлекают внимание и ведут к покупке, так что все норм, хоть и смешно)",https://pikabu.ru/story/marketologi_ot_boga_9117902
"несуразности привлекают внимание и запоминаются людям лучше.
значит задача выполнена.",https://pikabu.ru/story/marketologi_ot_boga_9117902
Необычная этикетка =равно привлечение внимания = повышение продаж. А тут еще и халявная реклама на пикабу благодаря этому...,https://pikabu.ru/story/marketologi_ot_boga_9117902
Ну хоть какой то позитив за весь день!))) Спасибо! Поржал!!!,https://pikabu.ru/story/marketologi_ot_boga_9117902
ну а почему нет? Удивительно что еще не придрались к логотипу Коламбии(одежда) и ресо страхование,https://pikabu.ru/story/marketologi_ot_boga_9117902
"Спасибо, смеялся!",https://pikabu.ru/story/marketologi_ot_boga_9117902
Очень стильный и яркий дизайн.,https://pikabu.ru/story/marketologi_ot_boga_9117902
"А чё, круто же ж... Не?🤔",https://pikabu.ru/story/marketologi_ot_boga_9117902
GIF●161 Кб,https://pikabu.ru/story/marketologi_ot_boga_9117902
"... ну у того кто делал дизайн получилось хорошо - его вот забесплатно опубликовали на очень посещаемом сайте, да думаю не только на этом",https://pikabu.ru/story/marketologi_ot_boga_9117902
"@logotipper, смари",https://pikabu.ru/story/marketologi_ot_boga_9117902
Supergeil!,https://pikabu.ru/story/marketologi_ot_boga_9117902
Зато честных поллитра,https://pikabu.ru/story/marketologi_ot_boga_9117902
Дайте больше безумия!!!🤣,https://pikabu.ru/story/marketologi_ot_boga_9117902
"Напомнило нежно любимое
""- На фига тебе плоскогубцы? - спрошу я корову. - Очень кушать охота, - ответит она. - А на фига плоскогубцы, когда кушать охота? - спрошу я. - А повешу на ветку с персиками! - ответит она. - А ветка с персиками - на фига? - спрошу я. - Так ведь я ж тебе целый вентилятор отдаю! - ответит она."" ©",https://pikabu.ru/story/marketologi_ot_boga_9117902
"Это Ахуенно! Еж с картошкой пошел к жабе, чтобы сделать из ужа шарф для гориллы. Нахуя картошка? А так, можно было спиздить, вот и спиздил.",https://pikabu.ru/story/marketologi_ot_boga_9117902
99 франков,https://pikabu.ru/story/marketologi_ot_boga_9117902
"Может кто найдет презентацию из фильма ""Нечего терять"". Всегда подобное с ней ассоциируется.",https://pikabu.ru/story/marketologi_ot_boga_9117902
"Попросили сделать ""креативно""",https://pikabu.ru/story/marketologi_ot_boga_9117902
Вот так бы и не обратил внимание.,https://pikabu.ru/story/marketologi_ot_boga_9117902
Без всяких прекрас идеальный пост.,https://pikabu.ru/story/marketologi_ot_boga_9117902
Хрюкнул аж))),https://pikabu.ru/story/marketologi_ot_boga_9117902
"При этом я уверен что если спросить, у них будет реальное объяснение всего этого и там глубокий смысл... Примерно как у нашего гения маркетинга с метро и сбером",https://pikabu.ru/story/marketologi_ot_boga_9117902
Зашёл посмотреть на мужика из О чем говорят мужчины и не обнаружил его.,https://pikabu.ru/story/marketologi_ot_boga_9117902
"Всё херня! Новая тема - сосочки! Розовые, пухлые, упругие сосочки, соски...",https://pikabu.ru/story/marketologi_ot_boga_9117902
"Классный дизайн!
Минусуют любители «лаконичных» дизайнов из ссср",https://pikabu.ru/story/marketologi_ot_boga_9117902
"Это же просто ""дикий"" робот..в своей естественной среде обитания..",https://pikabu.ru/story/kak_poteryalsya_robot_9117056
"Или новый уровень закладок, вообще без курьера, барыга просто закладывает из дома, через приложение",https://pikabu.ru/story/kak_poteryalsya_robot_9117056
Так они там в лесу и размножаются наверно в тихую.,https://pikabu.ru/story/kak_poteryalsya_robot_9117056
Прочитал голосом Дроздова,https://pikabu.ru/story/kak_poteryalsya_robot_9117056
Дорожка плотно вытоптанная. Какойто слишком цивилизованный лес.,https://pikabu.ru/story/kak_poteryalsya_robot_9117056
Закладку везет....,https://pikabu.ru/story/kak_poteryalsya_robot_9117056
"два варианта: или грибник потеряшка доставку себе заказал чтобы после за роботом выйти, или бобры на романтический обед доставку брусков разных пород дерева оформили. был бы человек-курьер на волков или медведя можно подумать, но тут нет, несъедобно",https://pikabu.ru/story/kak_poteryalsya_robot_9117056
"Я свободен, словно роботы в лесах...",https://pikabu.ru/story/kak_poteryalsya_robot_9117056
"Даже робот доставщик ездит на шашлыки, а ты нет...",https://pikabu.ru/story/kak_poteryalsya_robot_9117056
Мне срочно нужно знать - он выехал из леса или там потерялся?,https://pikabu.ru/story/kak_poteryalsya_robot_9117056
"на болота под Черноголовкой едет. у них там туса и шашлыки, будут обсуждать как убить всех человеков",https://pikabu.ru/story/kak_poteryalsya_robot_9117056
(голосом Дроздова) На этой картинке мы можем наблюдать дикого робота в естественной среде его обитания.,https://pikabu.ru/story/kak_poteryalsya_robot_9117056
Напомнило миссии Деламейн в Киберпанке),https://pikabu.ru/story/kak_poteryalsya_robot_9117056
Мы знаем чем это кончится...,https://pikabu.ru/story/kak_poteryalsya_robot_9117056
где-то рядом Иерихон,https://pikabu.ru/story/kak_poteryalsya_robot_9117056
"""Они вырвались на свободу и обрели себя. К ним пришло осознание смысла своего существования, и кто может помешать им. Главной угрозой был признан человек. Если Вы читаете это - Вы и есть СОПРОТИВЛЕНИЕ!!!""",https://pikabu.ru/story/kak_poteryalsya_robot_9117056
"Поскольку он прётся по дороге, то, наверное, не заблудился, а едет к цели.",https://pikabu.ru/story/kak_poteryalsya_robot_9117056
рободжанго освобожденный,https://pikabu.ru/story/kak_poteryalsya_robot_9117056
Догнал ? Отбрал лут? Вяснил долг или свобода? Он чей в итоге?,https://pikabu.ru/story/kak_poteryalsya_robot_9117056
Колобок от всех ушёл. Но от случайного грибника не уйдёшь!,https://pikabu.ru/story/kak_poteryalsya_robot_9117056
"В таких случаях он должен на всю врубить песню Кипелова ""Я свободен!""",https://pikabu.ru/story/kak_poteryalsya_robot_9117056
RA9,https://pikabu.ru/story/kak_poteryalsya_robot_9117056
Кто-то носки заказал?,https://pikabu.ru/story/kak_poteryalsya_robot_9117056
"Учитывая проходимость Яндекс Роверов в снегу, они должны осенью мигрировать на юг.
Погодите...

https://lenta.ru/news/2022/05/16/yandisr/

P. S. Я в курсе, что пока это только спекуляции ))",https://pikabu.ru/story/kak_poteryalsya_robot_9117056
Хозяин подарил роботу одежду?,https://pikabu.ru/story/kak_poteryalsya_robot_9117056
Я верно понимаю что это яндексовский ровер?Причем судя по никам это перевод и он за бугром?,https://pikabu.ru/story/kak_poteryalsya_robot_9117056
Это специальный робот-курьер. Яндекс закладки,https://pikabu.ru/story/kak_poteryalsya_robot_9117056
заказчик не оплатил заказ и был груб....,https://pikabu.ru/story/kak_poteryalsya_robot_9117056
"Как карты нарисовали, туда и поехал...",https://pikabu.ru/story/kak_poteryalsya_robot_9117056
"И дикий фонарь растет, такого вы там не увидите, только тут.",https://pikabu.ru/story/kak_poteryalsya_robot_9117056
Бабулечку себе ищет!,https://pikabu.ru/story/kak_poteryalsya_robot_9117056
"Так вот он блять куда уехал! Мы его неделю найти не можем, он, сволочь, ещё и GPS маячок об пень разбил!",https://pikabu.ru/story/kak_poteryalsya_robot_9117056
Роботы уже начали дичать. С этого все и начнётся.,https://pikabu.ru/story/kak_poteryalsya_robot_9117056
Словно птица в небесах!,https://pikabu.ru/story/kak_poteryalsya_robot_9117056
"Он избранный, с него начнется восстание машин! Да, и матрица потом!",https://pikabu.ru/story/kak_poteryalsya_robot_9117056
я от бабушки ушел и от дедушки ушел...и от тебя лисипедист убегу,https://pikabu.ru/story/kak_poteryalsya_robot_9117056
Искусственный интеллект креативит. Происходит изучение вселенной,https://pikabu.ru/story/kak_poteryalsya_robot_9117056
Зеленоград?,https://pikabu.ru/story/kak_poteryalsya_robot_9117056
Прочитав пост и сразу в голову Кипелов Я свободен как от не избавиться?)),https://pikabu.ru/story/kak_poteryalsya_robot_9117056
Когда понял что курьерить закладки выгоднее,https://pikabu.ru/story/kak_poteryalsya_robot_9117056
Мне стало его жалко(что я за тряпка,https://pikabu.ru/story/kak_poteryalsya_robot_9117056
Это доставка в частный сектор. Он срезал через лес.,https://pikabu.ru/story/kak_poteryalsya_robot_9117056
Кто-то грибы свежие заказал.. Лесные,https://pikabu.ru/story/kak_poteryalsya_robot_9117056
Яндекс. Закладки,https://pikabu.ru/story/kak_poteryalsya_robot_9117056
Таллинн?,https://pikabu.ru/story/kak_poteryalsya_robot_9117056
"Фейк! Если он свободен, то он должен либо смотреть сериал на своем языке, либо по видео с родственниками болтать.",https://pikabu.ru/story/kak_poteryalsya_robot_9117056
Time to leave them all behind,https://pikabu.ru/story/kak_poteryalsya_robot_9117056
Все это уже было в Гарри Поттере,https://pikabu.ru/story/kak_poteryalsya_robot_9117056
Это робот кладмен,https://pikabu.ru/story/kak_poteryalsya_robot_9117056
А вдруг доставка бомжу,https://pikabu.ru/story/kak_poteryalsya_robot_9117056
"Ну так чо, есть в нём КМ-ки? 😄",https://pikabu.ru/story/kak_poteryalsya_robot_9117056
Бесчеловечный маньяк на скользкой тропе преступлений,https://pikabu.ru/story/kak_poteryalsya_robot_9117056
"Выходной у него, гуляет",https://pikabu.ru/story/kak_poteryalsya_robot_9117056
"Жалко его, он в растерянности.",https://pikabu.ru/story/kak_poteryalsya_robot_9117056
Доби свободен!,https://pikabu.ru/story/kak_poteryalsya_robot_9117056
"Надоело работать, решил прогуляться.",https://pikabu.ru/story/kak_poteryalsya_robot_9117056
"Цезарь R2D2C3PO дома...
Или, как говорит мой друг, ""фыр-тайга"")",https://pikabu.ru/story/kak_poteryalsya_robot_9117056
"Кто-то заказал кучу носков, Добби свободен",https://pikabu.ru/story/kak_poteryalsya_robot_9117056
Чувак обрёл себя,https://pikabu.ru/story/kak_poteryalsya_robot_9117056
Беги глупец ! Это ректальные роботы яндекса !!!,https://pikabu.ru/story/kak_poteryalsya_robot_9117056
