Comment,https://Link"У меня муж сутками на работе хуярил, помочь не мог).
Я к тому - что вот эти 4 года лично я не могу охарактеризовать фразой ""дети - цветы жизни"". И я прям реально стала для них удобрением)
Я не к тому, что Вы не помогали, а к тому, что Вам это наверняка легче далось, чем жене. А потому для Вас дети - сплошное счастье, а для меня счастье пополам с проблемами и моего здоровья и их. И я себя прям выжимаю, чтоб у них всё в порядке было. Так сто спорить с предыдцщим комментатором смысла нет, у всех по-разному появление детей жизнь меняет.",https://pikabu.ru/story/tsvetyi_zhizni_9117033
"Наверное до 1 года жене вероятно было труднее, мы не сравнивали. Но мы изначально осознанно (на сколько это вообще возможно) заводили детей. Над вторым даже лет 5 трудились упорно в любом доступном месте. Поэтому изначально для нас овчинка стоила выделки и трудности это как дистанция на пути к победе воспринимался.",https://pikabu.ru/story/tsvetyi_zhizni_9117033
"Ну, Вы молодцы, что я могу сказать) здоровья Вашей семье.
Мы тоже детей осознанно заводили, но так ввшло, что нам не повезло и мы проиграли в генетическую лотерею - у старшего сына расстройство аутистического спектра.
А дочь просто шиложопая и непослушная получилась) так что для меня дети это не только счастье, но и бесконечный труд и непомерные усилия.",https://pikabu.ru/story/tsvetyi_zhizni_9117033
"У меня четырехмесячная дочь и ничего, время есть и поиграть, и погулять, и с товарищами встретится.
Да, его значительно меньше, но все же. Дело в распределении ответственности и обязанностей.
Мать тусит, отец сидит с ребенком. Отец тусит, мать сидит с ребенком.",https://pikabu.ru/story/tsvetyi_zhizni_9117033
"Пришла с работы сейчас домой, муж в метроида на свиче играет, сейчас поужинаем, и я за писишку сяду в асасина переигрывать. Или вместе в Лего Скайокера. Мы что-то делаем не так?)",https://pikabu.ru/story/tsvetyi_zhizni_9117033
Именно! Не так! Пора рожать!,https://pikabu.ru/story/tsvetyi_zhizni_9117033
Детей нет?,https://pikabu.ru/story/tsvetyi_zhizni_9117033
"Не поверите, но свободное время, что раньше вы тратили на себя, придется теперь делить на себя, жену, домашние дела и новую родню. А так же начинать копить на квартиру, ремонт в будущей детской и прочее. А кроме этого вам придется удалить из телефонной книги контакты бывших женщин и нельзя заводить романы ""на потрахаться""
Очень глупо вступать в брак, думая, что наличие второй половинки ничего не изменит.",https://pikabu.ru/story/tsvetyi_zhizni_9117033
"Во-первых, я в курсе, что такое брак и дети у меня есть)) во-вторых, а типа можно было встречаться с другими женщинами, когда вы ещё не женились, но уже встречались с будущей женой? Деньги тратиться начали только после свадьбы? Или бы сразу после знакомства в загс? Нормальные люди ещё пожить вместе успевают до брака, как раз чтобы присмотреться. Вам кажется наличие женщины мешает, а не брак)",https://pikabu.ru/story/tsvetyi_zhizni_9117033
"С потрахушками согласен, придется завязать, но этот момент самый очевидный. А вот с остальными можно спорить. Домашние дела и откладывание денег на квартиру/ремонт это в принципе атрибут взрослой жизни и от наличия женщины не зависит оэ совсем. Про хобби и свободное время, нормальный человек не будет ебать мозги на тему ""ты уделяешь мне слишком мало времени"". Иными словами, грамотно выбранная женщина меняет вашу жизнь процентов на 10-15 и то, зачастую не в худшую сторону. А вот что меняет жизнь, и к этому не готовы 90% взрослых людей, так это дети. После рождения ребенка вся жизнь переворачивается с ног на голову, а если ещё и в однушке, так вообще пиздец.",https://pikabu.ru/story/tsvetyi_zhizni_9117033
"Это если было с чем завязывать, далеко не у всех мужчин насыщенная сексуальная жизнь до брака, многие и женятся только для того, чтобы теплая пися под боком была.",https://pikabu.ru/story/tsvetyi_zhizni_9117033
фубля,https://pikabu.ru/story/tsvetyi_zhizni_9117033
"Через 5-6 лет с писей, у большинства, появляются проблемы, жена ""приебывается"". А уж когда родился ребенок, вообще туши свет. На пол года/год вообще без секса. И это в лучшем случае, у многих полтора-два года. А потом аккуратно, чтобы не разбудить ребенка, и это в двушке, что происходит в однушках я даже представить не могу.",https://pikabu.ru/story/tsvetyi_zhizni_9117033
"и новую родню
Это схуяли вдруг? Не хочу - не трачу, это личный выбор каждого.

А так же начинать копить на квартиру
А со своей что сделать? Продать?

Очень глупо вступать в брак, думая, что наличие второй половинки ничего не изменит.
То есть вот живу я с девушкой лет пять, все ок. А потом забежали в ЗАГС , проставили штамп  и......ПИЗДЕЦ как всё изменилось????",https://pikabu.ru/story/tsvetyi_zhizni_9117033
"А потом забежали в ЗАГС , проставили штамп и......ПИЗДЕЦ как всё изменилось????
а, кстати, очень часто такое. И со стороны девушки, и со стороны парня",https://pikabu.ru/story/tsvetyi_zhizni_9117033
Да.,https://pikabu.ru/story/tsvetyi_zhizni_9117033
"Может ты не готов к семье, так нахуя заводишь?",https://pikabu.ru/story/tsvetyi_zhizni_9117033
Да и на велике я катаюсь и с ребёнком с его полутора лет)) даже больше катаюсь теперь.,https://pikabu.ru/story/tsvetyi_zhizni_9117033
"А всё почему? Паматушто никто не учится на чужих примерах и ошибках, обязательно надо своих нафигачить.",https://pikabu.ru/story/tsvetyi_zhizni_9117033
"А вы прям родились, посмотрели вокруг и все тут же осознали и поняли и ниразу в жизни не накосячили.",https://pikabu.ru/story/tsvetyi_zhizni_9117033
"Если все или большинство семейных друзей, товарищей, приятелей, коллег, одногруппников и просто знакомых стонут под ""гнётом"" брака, наверно, можно сделать вывод, что это жжжж неспроста и подумать надо ли вступать в это всё? Или без разницы куда вступить, хоть в гавно, хоть в партию?) Тогда зачем ныть?🤷‍♂️",https://pikabu.ru/story/tsvetyi_zhizni_9117033
"У меня было чуточку иначе. Я замуж вышла одна из первых в тусовке. И, могу сказать, что первые 2,5 года была малина! Там реально было классно, и наш брак мотивировал других на отношения, но потом замуж по залету выходит подружайка, рожает и приседает на уши своим шикарным опытом с детьми, а у нее ребенок ну реально спокойный был, спал 20 часов в сутки, и никаких коликов! В общем ещё мама надавила и вуаля - я с лялькой. Сама не знаю, как получилось. Ну а вот дальше начался ад! И теперь я живу в аду!  А эти картинки из поста вызывают только истерику  и слезы раскаяния. Ничего больше не вернуть",https://pikabu.ru/story/tsvetyi_zhizni_9117033
"Не могу ничего сказать вам ободряющего, т.к. решение привести на этот свет живого человека, а не игрушку, должно приниматься только самостоятельно, без мам, подруг и прочих доброжелателей, потому как в моем понимании, нужно рожать только то количество детей, которое вывезешь в одну каску.
Да, с рождением детей мир перестает быть прежним, да, тяжело, да, хочется быть свободным ветром в поле, но ребёнок-это не конец света и не ад, а вполне себе новый мотиватор стать лучшей версией себя и возможность пережить такое детство, какого у меня не было.
И я знаю, что пишу, т.к. дочь ещё до своего рождения не была подарочным ребёнком.",https://pikabu.ru/story/tsvetyi_zhizni_9117033
"Дети - это полный отстой. Не знаете, где раздобыть машину времени?",https://pikabu.ru/story/tsvetyi_zhizni_9117033
"Да ладно, не надо меня жалеть. В конце концов, свобода это не главное.",https://pikabu.ru/story/tsvetyi_zhizni_9117033
"Значит в таоей жизни виноваты все кроме тебя. Ты ни одного решения не поняла сама и не несешь ответственность за них. Может поэтому и ад в жизни, инфантилизм",https://pikabu.ru/story/tsvetyi_zhizni_9117033
"Спасибо за честность, зайка",https://pikabu.ru/story/tsvetyi_zhizni_9117033
именно с лялькой ад или с мужем тоже плохо стало?,https://pikabu.ru/story/tsvetyi_zhizni_9117033
"Принесла домой я конвертик, а он орёт. Муж не выдержал и впал в истерику ""вот, вот, посмотри как она орет. Теперь это будет 18 лет орать"". В общем, да. А пока детей не было, жили довольно мирно. Проблемы сообща решали.",https://pikabu.ru/story/tsvetyi_zhizni_9117033
"То есть ваше мнение сформировало окружение и вы пренебрегать личным опытом?
очень эволюционная тактика. Но провальная местами.
Если ваш партнёр целостная личность и вы взаимно друг друга любите брак окажется самым лучшим опытом в вашей жизни. И это будет превосходить, в отдельных аспектах, любой опыт жизни в одиночку.",https://pikabu.ru/story/tsvetyi_zhizni_9117033
"Начнем с того, что в данном посте семья рассматривается как что-то негативное, а значит и что-то не нужное.
Далее адекватные люди не ноют, что семейная жизнь гавно, в игрушки не поиграть, баб не полапать, не покататься, дети тут еще какие-то, а понимают, с какой целью вступили в брак, анализируя чужой опыт. И как-то решают свои неурядицы.
Далее, сама я из семьи, мягко говоря, неблагополучной и среди моей родни вряд ли наберется пара-тройка хороших брачных союзов, считая мой. Я училась на чужих ошибках, в плане как НЕ надо делать, чтобы в семье было лучше, чем без неё.",https://pikabu.ru/story/tsvetyi_zhizni_9117033
"Комплекс жертвы, стокгольмский синдром",https://pikabu.ru/story/tsvetyi_zhizni_9117033
Ахахаха,https://pikabu.ru/story/tsvetyi_zhizni_9117033
"Если. К тому же, любовь проходит, а люди меняются со временем.",https://pikabu.ru/story/tsvetyi_zhizni_9117033
Настоящая не порходит.,https://pikabu.ru/story/tsvetyi_zhizni_9117033
"Люди меняются постоянно, это не нечто неизменное.",https://pikabu.ru/story/tsvetyi_zhizni_9117033
"Знаете, как тусовщик с огромным стажем, могу сказать, это так говорят люди слабые духом. Нормально с семьёй совмещать любой образ жизни.",https://pikabu.ru/story/tsvetyi_zhizni_9117033
"Знаешь, просто иди нахер!",https://pikabu.ru/story/tsvetyi_zhizni_9117033
"Ну с детьми это сложновато, а вот без детей с норм женой изи",https://pikabu.ru/story/tsvetyi_zhizni_9117033
"А после свадьбы внезапно понимаешь что досвадебный образ жизни отстой. Увлечений и хобби тупо слив бабла в унитаз, а друзья алкоголики. У меня появился партнёр который делится своими ресурсами и временем я могу достичь вдвое больше и быстрее тупо за счет масштабирования. Вот нафига мне досвадебный образ жизни?",https://pikabu.ru/story/tsvetyi_zhizni_9117033
"Ты только женился что-ли? Слив бабла в унитаз это очень полезное занятие иногда, потому, что когда бабло откладывается на полезные вещи, то ты теряешь вообще весь интерес к жизни. Вот например я хочу купить Ладу Надежду у бати  своего знакомого по цене металлома и чинить ее когда есть свободное время в гараже. Жена же мне говорит, что дома ремонт не сделан, кухня не сделана и нихера не сделано, но вот летом если у нее с работой все будет хорошо, то она хочет купить себе айфон так как он фоточки красивые делает...  Я при этом ничего ей не говорю. Но при этом я зарабатываю больше и свободные деньги должны тратиться на ремонт, не свободные на еду и коммуналку итп итд.  И я понимаю что ремонт делать надо... но для меня это самая нежелательная трата...",https://pikabu.ru/story/tsvetyi_zhizni_9117033
"И что же произошло, почему не сохранил? Все решения принимаешь ты! Так что не вали на детей жену и тд",https://pikabu.ru/story/tsvetyi_zhizni_9117033
В каждом варианте есть свои плюсы и минусы,https://pikabu.ru/story/tsvetyi_zhizni_9117033
"Мне достаточно посмотреть на своих женатых друзей, знакомых и родственников, что понять, что ну его нахуй!",https://pikabu.ru/story/tsvetyi_zhizni_9117033
"У меня нет семьи и мне охуенно. Я делаю что хочу, покупаю что хочу, когда хочу :)",https://pikabu.ru/story/tsvetyi_zhizni_9117033
"Мы с мужем внезапно тоже делаем и покупаем что хотим и когда хотим. Я не понимаю, каким образом наличие партнёра в этом ограничивает. Со свободным временем ещё ладно, там иногда могут быть варианты (задолбавшийся на работе муж просит сгонять за сигаретами, а мне очень лень, но все равно иду. плюс в том, что наоборот это тоже работает), но уж с покупками-то... Берешь и покупаешь, в чем проблема?
Правда, у нас детей нет, но это как раз укладывается в ""делаем что хотим"". Мы не хотим.",https://pikabu.ru/story/tsvetyi_zhizni_9117033
"Все очень зависит от уровня доходов. Кто-то и в одиночку нихуя себе купить не может. А кому-то и в большой семье денег достаточно.

У нас есть ребенок, он тоже не особо ограничивает в покупках в общем и целом. Муж в этом месяце немного сошел с ума и купил кофемашину и породистого кота :)",https://pikabu.ru/story/tsvetyi_zhizni_9117033
"Ребенок, как мне кажется, ограничивает не столько в покупках, сколько во времени и во внимании, которые можно было бы уделять другим вещам. С нашим уровнем отвественности нам и собака почти слишком, а тут целый живой человек. Ну и другие причины есть, конечно - от здоровья до политики.",https://pikabu.ru/story/tsvetyi_zhizni_9117033
"Со временем в точку :( у меня сейчас время на работу и личные дела есть только ночью. Но ребенок маленький не навсегда. Взамен он даёт гораздо больше, чем забирает. Но опять же это кому как",https://pikabu.ru/story/tsvetyi_zhizni_9117033
"А когда вам плохо, одиноко, заболели, или типа того, кто о вас заботится? Кто поддерживает в трудные моменты?",https://pikabu.ru/story/tsvetyi_zhizni_9117033
"Да, такие минусы есть. Но в то же время я понимаю, что не готов к обязательствам перед кем то.",https://pikabu.ru/story/tsvetyi_zhizni_9117033
"Пример здорового человека, оценил свои хотелки и понял, что не надо ему это. А не страдания, высосанные из пальца.)",https://pikabu.ru/story/tsvetyi_zhizni_9117033
"Правильно, полно людей, которые не хотят моногамных отношений и семью . Главное, вовремя осознать это и честно предупреждать об этом своих партнеров.",https://pikabu.ru/story/tsvetyi_zhizni_9117033
