Comment,https://Link
"Лёша, выходи сегодня же! За эти полтора месяца ничего важного на проекте не произошло.",https://pikabu.ru/story/proektnaya_deyatelnost_9117360
"Лёша, ты вообще единственный разработчик на проекте, а я твой ПМ ))",https://pikabu.ru/story/proektnaya_deyatelnost_9117360
Пистолет Макарова?,https://pikabu.ru/story/proektnaya_deyatelnost_9117360
"Проект Менеджер, если локализовать на русский то Главный Пиздюль.",https://pikabu.ru/story/proektnaya_deyatelnost_9117360
ГП? Гранатомёт подствольный?,https://pikabu.ru/story/proektnaya_deyatelnost_9117360
Говно из под Ногтей,https://pikabu.ru/story/proektnaya_deyatelnost_9117360
Можно нам другого составителя кроссвордов?,https://pikabu.ru/story/proektnaya_deyatelnost_9117360
"Кстати, а они хорошо получают и сложная ли работа?

Мне предложили переквалифицироваться на ПМ, но говорят учиться тяжело(",https://pikabu.ru/story/proektnaya_deyatelnost_9117360
"Я бывший ПМ. Учиться не тяжело, понимать реальность тяжело и потом все, чему учился практически на 100% применять надо, да и не хватит учебы честно говоря, будешь в процессе постигать :)
Могу так сказать, зависит от команды и проекта, то бишь ТЗ. Бывают проекты на несколько пачек персена, а бывают вообще комфортные, что даже с утра и кофе не надо.
Что за компания? Собственный продукт или в ит рабство? С собственным самый кайф, а в аутсорсе, тем более если возьмете проект какого-нибудь крупняка типа ""Самолет"" или ""Газпром"" можно такого головняка словить, что мама не горюй :)

PS: Сейчас ушел в кодинг обратно на фриланс, да и вообще кончаю с ИТ потихоньку. Картинка про меня ниже :)",https://pikabu.ru/story/proektnaya_deyatelnost_9117360
"написано чтото на выгораемом.
Я спустя 10 лет в ит понял что надо не торопиться за стеком. Хайлоад пубернетез, подман и прочая хуйня интересна когда тебя плющит. У меня даж времени не было решать кудать ехать в отпуск.  Прост, шо попало под руку - го.
и вот тут сказывается эхо слова ""плющит"". Когда ты в парке Нгоронгоро встаешь в 6 утра и видишь сообщения где тебя вызвали в пяти чатах. понимаешь масштаб пиздеца.
Я там почти год  не работаю. Но аукается до сих пор.
Даж по застарелым проектам с прошлой работы звонят до сих пор. Блять.",https://pikabu.ru/story/proektnaya_deyatelnost_9117360
"А как хотелось на крупные проекты, серьёзные задачи, ответственность.
Помните? )))",https://pikabu.ru/story/proektnaya_deyatelnost_9117360
У меня всё это само приходило. Меня не спрашивали. Я пьяный после бара в 2 часа ночи поднимал прод. И поднял же).пользователи не заметили.),https://pikabu.ru/story/proektnaya_deyatelnost_9117360
"Понял, спасибо большое за ответ!)

Сам я контент-менеджер на данный момент, предложили переучиться на ПМа. Проекты свои и их на самом деле немного это радует)

А сколько можно получать на такой работе в среднем, если не секрет?",https://pikabu.ru/story/proektnaya_deyatelnost_9117360
"Я как PM в основном работал по крупным торговым сетям и производствам. Старт с 250, в прошлом году к 450 приблизился, так как получил контракт с испанской компанией и доход был в евро. После 24 со мной разорвали контракт, да и я сам уже свалить захотел. Усталость есть небольшая после 22 лет в ИТ )))
На фрилансе как то все попроще ))",https://pikabu.ru/story/proektnaya_deyatelnost_9117360
"Я немножко слабо ориентируюсь в зарплатах у айтишников, 250 и 450 это в каких деньгах?)",https://pikabu.ru/story/proektnaya_deyatelnost_9117360
Шепотом: это в тысячах деревянных...,https://pikabu.ru/story/proektnaya_deyatelnost_9117360
"И зачем я на инженера учился(

Спасибо за ответ)",https://pikabu.ru/story/proektnaya_deyatelnost_9117360
"хуяссе в пятёрочке платят.
У меня товарищ в кодеры ушел в х5. на в два раза меньшую зп.",https://pikabu.ru/story/proektnaya_deyatelnost_9117360
"Как я себе представляю работу (глядя на наших проект-менеджеров): пинаешь исполнителей, которые загружены по горло и нет у них времени на твой объект, параллельно выслушиваешь от заказчика ""какого хрена?!"" и договариваешься подождать ещё чуть-чуть. Параллельно делаешь отчеты о ходе разработки проекта. Кому-то такое нравится, для меня это нервотрепка)",https://pikabu.ru/story/proektnaya_deyatelnost_9117360
"ага, а на аналитиках сэкономили, потому разрабы с девопсами и тестерами согласовывают самостоятельно схему продакшена, автотестов и интеграции гитлаба с жирой.",https://pikabu.ru/story/proektnaya_deyatelnost_9117360
"Да, еще всяки скрумы, агилы, надо знать всякие джиры-асаны.",https://pikabu.ru/story/proektnaya_deyatelnost_9117360
Познай скрам и пойми что там нету ПМа),https://pikabu.ru/story/proektnaya_deyatelnost_9117360
"""Да ты чо, пес, я SCRUM-мастер!""",https://pikabu.ru/story/proektnaya_deyatelnost_9117360
Там другие задачи совершенно),https://pikabu.ru/story/proektnaya_deyatelnost_9117360
"И там РО, а не РМ, а так да",https://pikabu.ru/story/proektnaya_deyatelnost_9117360
"Я рп в 1с, но у меня нет бизнес-аналитика, системного-аналитика, тестировщика, администратора проекта. Приходиться заниматься бизнес-моделированием, системным анализом, проектировать целевую ИС, разрабатывать ТТ, ЧТЗ, ставить постановки, тестировать результаты, оформлять техническую документацию, готовить отчёты, организовывать митинги, конфы. При этом ещё приходиться вести 2-3 проекта. Работаю в системообразующем холдинге. ЗП смешная, не более 110к",https://pikabu.ru/story/proektnaya_deyatelnost_9117360
Один вопрос - а зачем? Зп РП одинэсного сейчас от двухсот. От! Человек-оркестр в небольшой относительно компании тоже. Только ответственности и там и там сильно поменьше,https://pikabu.ru/story/proektnaya_deyatelnost_9117360
"Только вошёл в it. До этого 1с был второстепенной деятельностью. Ранее, в основном, занимался логистикой складов, товародвижения, закупок, производства. 2 года назад ушёл плотно в 1с и бизнес-моделирование. Сертификат пока нет. Возьму сертификаты, получу, наконец, официальное высшее образование, уйду дальше. Из-за этого меня пока пользуют)",https://pikabu.ru/story/proektnaya_deyatelnost_9117360
"Сертификаты нах не нужны. Если знаете основы учета, а судя по всему знаете, то чего бояться? Смотрите на местный рынок и продайте себя. Не подстраивайтесь под предложения. Одинэсников реальная нехватка",https://pikabu.ru/story/proektnaya_deyatelnost_9117360
"И то, что я человек-оркестр, для проекта ничего хорошего. Сроки затягиваются, затраты растут. Жду, пинаю руководство чтобы ресурсами обеспечили.",https://pikabu.ru/story/proektnaya_deyatelnost_9117360
Не дождетесь себя скорее всего. Это удобно руководству. И затраты растут с вашей точки зрения. А с их они просто чуть меньше экономят,https://pikabu.ru/story/proektnaya_deyatelnost_9117360
"Мы на бизнес работаем, если проект не взлетит к сроку, потеряют в 30 раз больше. Проблема в том, что проект должен был начаться больше года назад, но из-за кадровых проблем, работы начались только при моём трудоустройстве, месяцев 5 назад",https://pikabu.ru/story/proektnaya_deyatelnost_9117360
"Можно, я улыбаюсь? То есть вам ближе проблемы работодателя? Кадровые проблемы как раз и возникают из-за того, что они ищут дёшево и высококлассно. Это с их стороны хорошо. Но есть и другая сторона - вы. И тут два варианта - вас устраивает практика за малые деньги. Или вас это не устраивает. Целый анекдот про это есть.
так что решите для себя - вас устраивает роль человека-ансамбля ща цену одного разработчика мидл минус. Если нет, то сами предложите вариант работодателю стать зарплатодателем. Или расширить команду. Или ещё чего. Руководство часто очень не глупое, но само оно точно не предложил увеличить затраты",https://pikabu.ru/story/proektnaya_deyatelnost_9117360
"Обязательно нанимайте бизнес-аналитика. Хоть на аутсорс берите. Тестер в 1С это и сам разраб может, но анализ процессов вы нормально не сделаете с такой нагрузкой. Выйдет выгорашка через пару лет и всё",https://pikabu.ru/story/proektnaya_deyatelnost_9117360
С апреля месяца директива по корпорации пришла о приостановке взаимоотношений с аутсорсом.,https://pikabu.ru/story/proektnaya_deyatelnost_9117360
"На днях познал смысл эпитета ""особая форма извращения над здравым смыслом"" При описании процессов заказчика",https://pikabu.ru/story/proektnaya_deyatelnost_9117360
"Хуяк-хуяк, и в продакшн",https://pikabu.ru/story/proektnaya_deyatelnost_9117360
Подожду за вами,https://pikabu.ru/story/proektnaya_deyatelnost_9117360
"Кто тебе предложил ,если ты даже не знаешь сколько они получают примерно",https://pikabu.ru/story/proektnaya_deyatelnost_9117360
Сейчас уже знаю),https://pikabu.ru/story/proektnaya_deyatelnost_9117360
"Если знаете и умеете  все технологии разработки, системного администрирования и любите общаться, то не сложная.
Доучиться только делопроизводство,  бух учет и ГОСТы, на уровне понимания бизнес процессов.",https://pikabu.ru/story/proektnaya_deyatelnost_9117360
Пиздюлей Материализатор,https://pikabu.ru/story/proektnaya_deyatelnost_9117360
"На прошлой работе мы ПМ-а полуменеджером, или групенфюрером называди",https://pikabu.ru/story/proektnaya_deyatelnost_9117360
Группенфюрерром тим лида называем ),https://pikabu.ru/story/proektnaya_deyatelnost_9117360
А вот это еще более жизненно),https://pikabu.ru/story/proektnaya_deyatelnost_9117360
"О, да, как жизненно.
Особенно, когда тебя гонят - быстрее-быстрее, надо срочно сдать проект за 2 недели.
Потом в процессе из-за кого-то задержка, и проект сдаешь через 2-3 месяца - и всё норм, всем пофигу.
Зачем гонят изначально - хз.",https://pikabu.ru/story/proektnaya_deyatelnost_9117360
"потому что если не подпинывать, то два месяца запросто можно растянуть на год.",https://pikabu.ru/story/proektnaya_deyatelnost_9117360
Одно дело подпинывать другое дело с плетью стоять и хуярить по кд,https://pikabu.ru/story/proektnaya_deyatelnost_9117360
"ПОТому что вы, звери зазрабавые, очень дорого стоите",https://pikabu.ru/story/proektnaya_deyatelnost_9117360
Пидарасы.,https://pikabu.ru/story/proektnaya_deyatelnost_9117360
"Заказчик полтора месяца ебал всем мозги вносил и согласовывал правки, а потом с Мальдив вернулся второй совладелец компании. Он посмотрел дизайн, в общем у них новая концепция, начинаем с самого первого варианта, только вот это нужно передвинуть буквально на два пикселя влево, а вот здесь...",https://pikabu.ru/story/proektnaya_deyatelnost_9117360
"Так я что, не уволен? Это же надо отметить!",https://pikabu.ru/story/proektnaya_deyatelnost_9117360
"Более того, от нас ушел АвтоКад. И все, что ты делал на компьютере, придется переделывать на чертильной доске, которую тебе придется заказать и оплатить за счет будущей зарплаты. Примерный бюджет доски уже заложен в твой зарплатный квиток за следующий месяц и обсуждению не подлежит.",https://pikabu.ru/story/proektnaya_deyatelnost_9117360
Эта причина была первый раз забухать,https://pikabu.ru/story/proektnaya_deyatelnost_9117360
Да),https://pikabu.ru/story/proektnaya_deyatelnost_9117360
Поэтому и не выйдет,https://pikabu.ru/story/proektnaya_deyatelnost_9117360
"У нас так один новенький забухал (отработал 2 месяца), на новогодних праздниках. Все вышли, даже те, на которых думали что не выйдут, а этого нету ... Когда до него дозвонились он выдал примерно следующее: ""сколько я могу ещё бухать чтобы меня не уволили?""",https://pikabu.ru/story/proektnaya_deyatelnost_9117360
"Была похожая ситуация, на аутсорсе один чел обслуживал наш сайт бюджетной организации. Как принято у бюджетников постоянно надо размещать всякие регламенты,положения и прочую хрень, которую министерство издает, а потом проверяет на выполнение. Так вот, чел который вел наш сайт, просто перестал выходить на связь, кое как нашли номер его родственников, оказалось, что у него кукуха слетела и положили в психоневрологический диспансер, наш эникейщик через санитаров логин и пароль от админки выклянчивал :'D",https://pikabu.ru/story/proektnaya_deyatelnost_9117360
Ну зато честно. Бывал в похожей ситуации... стыдно пиздец было.,https://pikabu.ru/story/proektnaya_deyatelnost_9117360
Айтишники берите на вооружение!,https://pikabu.ru/story/proektnaya_deyatelnost_9117360
"Это вот у меня сейчас происходит. Только что на заводе был, сотрудницы нет.
Оказывается, она сперва поехала на праздники к сыну, там осталась, прогуляла на той неделе 4 дня, а теперь у неё давление, и она через неделю записана к врачу.
Вот что с такими делать? И ведь была лучшим контролером всё предшествовавшее время!",https://pikabu.ru/story/proektnaya_deyatelnost_9117360
"У нас есть есть несколько таких сотрудников, причем женщины, запойные, да. Но хорошие работники, раз в 1-2 года срываются, нет где-то дней 10, не увольняем, потому алкоголизм - это к сожалению болезнь, они держатся, как могут, даже кодируются периодически (не знаю, это работает реально или развод). Чаще всего на длинные праздники, новогодние или майские срываются. Особенно если и родители запойные, и бабушки например, то трудно с этим бороться. Потом , как отойдут, выходят на подработки даже. Скажем так, от запойных даже меньше проблем, чем от тех, кто постоянно прибухивает, особенно как начальства нет, как стресс у них какой-то, или по любым праздникам, а праздники в России каждый месяц. Единственное, что каждый запой - это огромный риск помереть, но тут уж не наши проблемы.",https://pikabu.ru/story/proektnaya_deyatelnost_9117360
"Ушел в запой меньшее из зол... У нас так чел пропал, не вышел и все. На личный трубку не берет, на рабочий тоже. Сначала тоже думали забухал, бывший спецназовец, горячие точки и все вытекающие. Через три дня начали искать адрес, но этот товарищ указал только номер дома где снимал квартиру, 6 подъездная 14 этажка. Через 10 дней позвонила его квартирная хозяйка. Парня долбанул инсульт. Все это время он лежал без медицинской помощи,жил один, ни девушки ни жены не было. Парализовало, отнялась речь, но до воды видимо он как то доползал, сложно сказать. Вытащили его с того света врачи, но остался инвалидом, речь вернулась частично, родители забрали домой. Так что не всегда пропажа сотрудника банальное забухал. У мужа на работе сотрудник в аварию попал насмерть по дороге на работу, тоже думали не вышел потому что запил.",https://pikabu.ru/story/proektnaya_deyatelnost_9117360
"Мне как-то написала девушка которую я очень сильно добивался через пару месяцев как закончили общение. Я закончил, тратил кучу сил, а все двигалось очень незначительно э, выдохся. Спросила как я, и рассказала что я ей помог поднять самооценку и она начала встечаться с тем по кому сохла безрезультатно. С одной стороны обидно что не вышло с ней. Но это была чистая любовь, без негатива. Так я понял что я и в правду хороший человек. Дружбу она не предлогала, просто хотела узнать, не ебнулся ли я после такой истории. Закончили общение на всеобщих пожеланиях хорошего будущего. Более не общались, но вспоминаю ее добрым словом. Сейчас счастлив с другой, той что безумно любит меня и я люблю ее. Заканчивайте отношения без негатива, оставляя их в прошлом, иначе это будет влиять на будущие",https://pikabu.ru/story/proektnaya_deyatelnost_9117360
"взяли мы как то нового грузчика на работу, неплохо выглядел, неплохо одет, с речью вроде норм, на машине и живёт рядом. Проработал он около двух недель и пропал. На звонки не отвечал, на сообщения тоже. Через неделю появился. Оказалось забухал... Решили уволить не по причине того что забухал, а по банальному - забил хер на звонки. Ну хочется тебе блин уйти в запой - возьми отпуск за свой счёт, бухай и выходи на работу. Взрослый мужик, около 45 лет, а мозгов нет",https://pikabu.ru/story/proektnaya_deyatelnost_9117360
